ticker,current_price,managers_shown,total_value,portfolio_pct,buy_count,buying_managers,shares_bought,periods,activities,52_week_low,52_week_high,52_week_position_pct,near_52w_low,value_opportunity_score,opportunity_type,_analysis_type,_generated,_periods,_window_quarters
BRK.B,473.6,5,16661841000,6.81,10,"David Katz, Robert Olstein, Christopher Bloomstran, Duan Yongping, Thomas Russo, +3 more",4144059,"Q3 2025, Q4 2025",Add 0.09%; Add 44.74%; Add 1.45%; Add 38.24%; Add 53.53%,455.19,542.07,21.19014732965011,True,16689.721985267035,Strong Accumulation,52_week_low_buys,2026-05-01,"Q1 2026, Q4 2025, Q3 2025",3
COF,191.3,5,12894547000,3.27,6,"Bill Nygren, Viking Global Investors, Glenn Greenberg, Lee Ainslie, Ariel Investments, +1 more",4026067,"Q4 2025, Q3 2025",Add 19.94%; Add 30.28%; Add 4.57%; Add 19.60%; Add 9.37%,174.98,258.65,19.505198996055963,True,12914.596480100396,Strong Accumulation,52_week_low_buys,2026-05-01,"Q1 2026, Q4 2025, Q3 2025",3
MA,502.92,5,8496922000,5.26,6,"Stephen Mandel, Valley Forge Capital Management, AKO Capital, Francois Rochon, John Armitage, +1 more",268559,"Q4 2025, Q3 2025",Buy; Add 0.18%; Add 3.73%; Add 9.55%; Add 6.47%,479.68,599.05,19.46887827762421,True,8516.975112172238,Strong Accumulation,52_week_low_buys,2026-05-01,"Q1 2026, Q4 2025, Q3 2025",3
KHC,22.66,5,8234366000,2.42,4,"Prem Watsa, Lee Ainslie, Mason Hawkins",1173571,"Q3 2025, Q4 2025",Add 4.81%; Add 33.28%; Buy; Add 23.39%,21.04,27.85,23.788546255506617,True,8249.987145374449,Value Buying,52_week_low_buys,2026-05-01,"Q1 2026, Q4 2025, Q3 2025",3
WTW,256.2,5,6290075000,2.82,6,"Robert Olstein, Bill Nygren, Seth Klarman, Dodge & Cox Funds",7750670,"Q1 2026, Q4 2025, Q3 2025",Add 53.95%; Add 30.70%; Add 13.43%; Add 24.66%; Add 90.67%,246.61,350.65,9.217608612072258,True,6311.153239138793,Strong Accumulation,52_week_low_buys,2026-05-01,"Q1 2026, Q4 2025, Q3 2025",3
AON,311.65,5,5774011000,1.34,11,"First Pacific Advisors, Bill Nygren, Viking Global Investors, Dodge & Cox Funds, Wallace Weitz, +3 more",9291206,"Q4 2025, Q3 2025",Add 0.32%; Add 0.37%; Add 0.72%; Buy; Add 126.64%,304.59,378.56,9.544409895903744,True,5805.05655901041,Strong Accumulation,52_week_low_buys,2026-05-01,"Q1 2026, Q4 2025, Q3 2025",3
CRM,176.53,5,5232322000,3.03,10,"Bill Nygren, ValueAct Capital, Mairs & Power Funds, Harry Burn, Vulcan Value Partners, +2 more",8926343,"Q4 2025, Q3 2025",Add 38.95%; Add 135.47%; Add 3.31%; Add 0.42%; Add 16.13%,163.52,293.86,9.981586619610242,True,5261.32384133804,Strong Accumulation,52_week_low_buys,2026-05-01,"Q1 2026, Q4 2025, Q3 2025",3
CHTR,165.17,5,5041327000,3.66,8,"First Pacific Advisors, Bill Nygren, Lee Ainslie, Dodge & Cox Funds, Wallace Weitz, +1 more",6599565,"Q3 2025, Q4 2025",Add 3.13%; Add 24.33%; Buy; Add 23.73%; Add 6.12%,158.0,437.06,2.569339926897437,True,5067.070066007311,Strong Accumulation,52_week_low_buys,2026-05-01,"Q1 2026, Q4 2025, Q3 2025",3
FISV,62.65,5,4802094000,1.23,20,"David Katz, Robert Olstein, Hillman Value Fund, Bill Nygren, Norbert Lou, +5 more",34804260,"Q3 2025, Q4 2025",Add 706.36%; Add 84.13%; Add 72.87%; Buy; Add 129.96%,52.91,191.91,7.007194244604318,True,4851.393280575539,Strong Accumulation,52_week_low_buys,2026-05-01,"Q1 2026, Q4 2025, Q3 2025",3
BKNG,168.36,5,4511304000,3.0,6,"Henry Ellenbogen, David Rolfe, Lee Ainslie, Dodge & Cox Funds, Francois Rochon",1925000,"Q3 2025, Q4 2025",Add 48.28%; Add 4.33%; Buy; Add 8.44%; Add 0.48%,150.28,232.2,22.070312500000018,True,4531.09696875,Strong Accumulation,52_week_low_buys,2026-05-01,"Q1 2026, Q4 2025, Q3 2025",3
UBER,74.61,5,4075820000,3.05,9,"Robert Olstein, First Pacific Advisors, Thomas Russo, Polen Capital Management, William Von Mueffling, +2 more",7793923,"Q1 2026, Q4 2025, Q3 2025",Add 15.22%; Add 64.29%; Buy; Add 1.96%; Add 9.22%,68.46,101.99,18.341783477482867,True,4101.985821652252,Strong Accumulation,52_week_low_buys,2026-05-01,"Q1 2026, Q4 2025, Q3 2025",3
GEHC,60.84,5,3999491000,1.26,10,"Bill Nygren, Nelson Peltz, Leon Cooperman, Dodge & Cox Funds, Harry Burn, +1 more",14257752,"Q4 2025, Q3 2025",Add 43.85%; Add 13.95%; Add 0.37%; Add 11.67%; Add 50.00%,58.75,89.69,6.755009696186179,True,4028.8154990303815,Strong Accumulation,52_week_low_buys,2026-05-01,"Q1 2026, Q4 2025, Q3 2025",3
FIS,46.53,5,3704886000,2.8,7,"Robert Olstein, Seth Klarman, Dodge & Cox Funds, Harry Burn",14940913,"Q1 2026, Q4 2025, Q3 2025",Add 43.25%; Add 7.50%; Add 28.41%; Add 18.84%; Add 13.94%,43.3,81.06,8.554025423728822,True,3728.030597457627,Strong Accumulation,52_week_low_buys,2026-05-01,"Q1 2026, Q4 2025, Q3 2025",3
ORCL,161.39,5,3398661000,1.16,5,"Hillman Value Fund, Mairs & Power Funds, William Von Mueffling, Christopher Davis",47126,"Q1 2026, Q4 2025, Q3 2025",Buy; Add 62.49%; Add 23.38%; Add 0.75%; Add 18.44%,134.57,343.01,12.867012089810014,True,3417.374298791019,Strong Accumulation,52_week_low_buys,2026-05-01,"Q1 2026, Q4 2025, Q3 2025",3
ZBH,82.43,5,3370074000,1.32,9,"Robert Olstein, Bill Nygren, Dodge & Cox Funds, Ariel Investments, Sarah Ketterer",10242773,"Q1 2026, Q4 2025, Q3 2025",Add 6.10%; Add 5.13%; Add 158.17%; Add 27.29%; Add 1.25%,79.83,107.45,9.413468501086198,True,3397.132653149892,Strong Accumulation,52_week_low_buys,2026-05-01,"Q1 2026, Q4 2025, Q3 2025",3
IQV,158.37,5,3275251000,1.38,4,"Viking Global Investors, William Von Mueffling, Vulcan Value Partners",1058879,"Q4 2025, Q3 2025",Buy; Add 0.74%; Add 27.30%; Add 1.82%,134.65,247.05,21.103202846975087,True,3291.1406797153027,Value Buying,52_week_low_buys,2026-05-01,"Q1 2026, Q4 2025, Q3 2025",3
CPNG,19.98,5,2915448000,2.43,5,"Henry Ellenbogen, Chase Coleman, Dodge & Cox Funds",15389687,"Q3 2025, Q4 2025",Add 0.36%; Add 65.85%; Add 16.58%; Add 4.87%; Add 0.71%,16.74,34.08,18.685121107266447,True,2933.5794878892734,Strong Accumulation,52_week_low_buys,2026-05-01,"Q1 2026, Q4 2025, Q3 2025",3
CTSH,52.9,5,2872125000,2.02,4,"Richard Pzena, Sarah Ketterer",3264863,"Q1 2026, Q3 2025, Q4 2025",Add 14.94%; Add 1.49%; Add 14.97%; Add 14.29%,52.34,86.59,1.635036496350351,True,2889.961496350365,Deep Value,52_week_low_buys,2026-05-01,"Q1 2026, Q4 2025, Q3 2025",3
PDD,99.88,5,2628047000,5.94,4,"Duan Yongping, Dodge & Cox Funds, Sarah Ketterer",7773541,"Q4 2025, Q3 2025",Add 34.55%; Buy; Add 19.89%,95.24,139.41,10.5048675571655,True,2644.9965132442835,Value Buying,52_week_low_buys,2026-05-01,"Q1 2026, Q4 2025, Q3 2025",3
BAX,17.58,5,2585493000,1.55,10,"Richard Pzena, Robert Olstein, Hillman Value Fund, Greenhaven Associates, Dodge & Cox Funds",50513704,"Q4 2025, Q3 2025, Q1 2026",Add 22.06%; Add 45.89%; Add 11.27%; Add 14.25%; Add 35.69%,15.73,32.24,11.205330102967883,True,2614.3724669897038,Strong Accumulation,52_week_low_buys,2026-05-01,"Q1 2026, Q4 2025, Q3 2025",3
SE,84.88,5,2537710000,1.9,4,"Viking Global Investors, Stephen Mandel, Howard Marks, First Eagle Investment Management",2559729,"Q4 2025, Q3 2025",Add 20.81%; Buy; Add 69.28%,77.05,199.3,6.404907975460121,True,2555.069509202454,Deep Value,52_week_low_buys,2026-05-01,"Q1 2026, Q4 2025, Q3 2025",3
EFX,173.94,5,2466791000,1.46,13,"Lindsell Train, Robert Olstein, Bill Nygren, Valley Forge Capital Management, AKO Capital, +3 more",2541841,"Q1 2026, Q4 2025, Q3 2025",Add 4.55%; Add 4.76%; Add 1.94%; Add 105.56%; Add 20.00%,165.57,278.52,7.410358565737056,True,2502.0499641434267,Strong Accumulation,52_week_low_buys,2026-05-01,"Q1 2026, Q4 2025, Q3 2025",3
FLUT,107.93,5,2420711000,3.35,8,"Bill Nygren, Daniel Loeb, Henry Ellenbogen, Chase Coleman, AKO Capital, +2 more",2105344,"Q4 2025, Q3 2025",Add 58.86%; Add 4.67%; Add 274.15%; Add 9.44%; Add 5.93%,98.88,313.69,4.213025464363861,True,2446.289697453564,Strong Accumulation,52_week_low_buys,2026-05-01,"Q1 2026, Q4 2025, Q3 2025",3
FICO,1025.0,5,2233929000,6.59,7,"Lindsell Train, Valley Forge Capital Management, Chuck Akre, Jensen Investment Management, Yacktman Asset Management",306492,"Q1 2026, Q4 2025, Q3 2025",Add 15.16%; Add 0.13%; Add 6.36%; Add 2751.43%; Buy,870.01,2217.6,11.501272642272504,True,2256.778872735773,Strong Accumulation,52_week_low_buys,2026-05-01,"Q1 2026, Q4 2025, Q3 2025",3
MDT,80.97,5,2042522000,1.1,6,"David Katz, Robert Olstein, Dodge & Cox Funds, First Eagle Investment Management",66571,"Q1 2026, Q3 2025, Q4 2025",Add 1.67%; Add 0.39%; Add 3.57%; Add 0.17%; Add 0.41%,77.47,104.7,12.853470437017997,True,2063.2366529562983,Strong Accumulation,52_week_low_buys,2026-05-01,"Q1 2026, Q4 2025, Q3 2025",3
TMUS,195.5,5,2018461000,0.9,4,"Richard Pzena, Viking Global Investors, Dodge & Cox Funds",3352327,"Q1 2026, Q4 2025, Q3 2025",Buy; Add 15.07%; Add 14.66%; Add 65.24%,180.49,258.12,19.335308514749443,True,2034.5274691485247,Value Buying,52_week_low_buys,2026-05-01,"Q1 2026, Q4 2025, Q3 2025",3
AIG,74.8,5,1928300000,1.25,4,"Richard Pzena, Bill Nygren",4896198,"Q1 2026, Q3 2025, Q4 2025",Add 2.14%; Add 2.73%; Add 24.46%; Add 3.03%,70.83,86.78,24.890282131661436,True,1943.8109717868335,Value Buying,52_week_low_buys,2026-05-01,"Q1 2026, Q4 2025, Q3 2025",3
LEN,90.3,5,1908155000,6.62,5,"Greenhaven Associates, Warren Buffett, Glenn Greenberg",1546411,"Q1 2026, Q4 2025, Q3 2025",Add 5.33%; Add 4.57%; Add 1.68%; Add 0.03%; Add 20.24%,82.59,142.23,12.92756539235412,True,1926.8622434607648,Strong Accumulation,52_week_low_buys,2026-05-01,"Q1 2026, Q4 2025, Q3 2025",3
CSGP,34.61,5,1851600000,4.08,5,"Daniel Loeb, Chuck Akre, Dennis Hong, Vulcan Value Partners",1289380,"Q4 2025, Q3 2025",Add 4.91%; Add 3.35%; Add 6.87%; Add 17.05%; Add 3.10%,33.32,97.43,2.012166588675712,True,1871.398783341132,Strong Accumulation,52_week_low_buys,2026-05-01,"Q1 2026, Q4 2025, Q3 2025",3
TDG,1159.98,5,1805060000,11.88,4,"Stephen Mandel, Bryan Lawrence, Triple Frond Partners, Vulcan Value Partners",87083,"Q4 2025, Q3 2025",Buy; Add 13.51%; Add 82.39%; Add 7.79%,1123.61,1519.35,9.19037752059436,True,1822.1409622479405,Deep Value,52_week_low_buys,2026-05-01,"Q1 2026, Q4 2025, Q3 2025",3
ADBE,246.1,5,1666097000,0.82,14,"Lindsell Train, Richard Pzena, Robert Olstein, Lee Ainslie, Dodge & Cox Funds, +1 more",2478396,"Q1 2026, Q4 2025, Q3 2025",Add 32.08%; Add 17.78%; Add 26.40%; Add 20.67%; Add 4.36%,224.13,422.95,11.050196157328235,True,1702.9919803842672,Strong Accumulation,52_week_low_buys,2026-05-01,"Q1 2026, Q4 2025, Q3 2025",3
DASH,168.65,5,1681286000,3.01,6,"Stephen Mandel, Henry Ellenbogen, Lee Ainslie, Thomas Russo, First Eagle Investment Management",5439521,"Q4 2025, Q3 2025",Buy; Add 114.08%; Add 62.83%; Add 6200.44%; Add 0.44%,143.3,285.5,17.827004219409282,True,1701.503299578059,Strong Accumulation,52_week_low_buys,2026-05-01,"Q1 2026, Q4 2025, Q3 2025",3
ECL,260.6,5,1659881000,1.66,1,First Eagle Investment Management,15,Q4 2025,Buy,246.02,308.44,23.35789810958029,True,1669.545210189042,Value Buying,52_week_low_buys,2026-05-01,"Q1 2026, Q4 2025, Q3 2025",3
WAT,309.23,5,1655303000,3.28,3,"Robert Olstein, AKO Capital, Terry Smith",376693,"Q1 2026, Q3 2025",Buy; Add 2.49%; Add 9.62%,275.05,414.15,24.572250179726822,True,1668.8457749820277,Value Buying,52_week_low_buys,2026-05-01,"Q1 2026, Q4 2025, Q3 2025",3
AVTR,8.1,5,1614335000,1.63,9,"Robert Olstein, Greenhaven Associates, First Pacific Advisors, Mason Hawkins, Dodge & Cox Funds",32583640,"Q1 2026, Q4 2025, Q3 2025",Add 47.92%; Add 3.02%; Add 16.94%; Add 10.21%; Add 11.95%,7.27,15.93,9.58429561200924,True,1641.376570438799,Strong Accumulation,52_week_low_buys,2026-05-01,"Q1 2026, Q4 2025, Q3 2025",3
INTU,388.5,5,1611598000,2.84,10,"Lindsell Train, Richard Pzena, David Katz, Viking Global Investors, Terry Smith, +3 more",1338731,"Q1 2026, Q3 2025, Q4 2025",Add 20.23%; Buy; Add 720.67%; Add 0.22%; Add 3.50%,342.11,808.22,9.95258629937139,True,1640.6027413700629,Strong Accumulation,52_week_low_buys,2026-05-01,"Q1 2026, Q4 2025, Q3 2025",3
HLN,9.24,5,1569405000,0.27,2,First Eagle Investment Management,551676,"Q4 2025, Q3 2025",Add 9.11%; Add 9.81%,8.6,11.2,24.61538461538464,True,1580.9434615384614,Value Buying,52_week_low_buys,2026-05-01,"Q1 2026, Q4 2025, Q3 2025",3
HHH,62.27,5,1508007000,3.23,1,Polen Capital Management,23823,Q3 2025,Buy,61.01,91.07,4.191616766467083,True,1519.5878383233533,Deep Value,52_week_low_buys,2026-05-01,"Q1 2026, Q4 2025, Q3 2025",3
BSX,57.61,5,1445454000,1.58,5,"Stephen Mandel, Lee Ainslie, Polen Capital Management, John Armitage",12488371,"Q4 2025, Q3 2025",Buy; Add 1.37%; Add 223.74%,56.05,109.5,2.9186155285313418,True,1465.1621384471468,Strong Accumulation,52_week_low_buys,2026-05-01,"Q1 2026, Q4 2025, Q3 2025",3
DPZ,339.42,5,1414062000,4.2,2,Warren Buffett,716132,"Q4 2025, Q3 2025",Add 12.34%; Add 13.22%,326.54,490.77,7.8426596845886865,True,1427.277734031541,Deep Value,52_week_low_buys,2026-05-01,"Q1 2026, Q4 2025, Q3 2025",3
