ticker,company_name,current_price,manager_count,managers,total_value,avg_portfolio_pct,index,total_shares,max_portfolio_pct,recent_buys,latest_buy_quarter,price_opportunity_score,price_category,_analysis_type,_generated,_periods,_window_quarters
DIS,Walt Disney Co.,96.25,22,"Duan Yongping, Lee Ainslie, Viking Global Investors, ValueAct Capital, Christopher Bloomstran, +5 more",2998620000,1.79,297,31112469,9.85,27.0,Q4 2025,72.78681818181818,Higher Price,stocks_under_$100,2026-07-01,"Q1 2026, Q4 2025, Q3 2025",3
BAC,Bank of America Corp.,56.98,15,"Li Lu, Bill Nygren, Glenn Greenberg, Warren Buffett, Arnold Van Den Berg, +5 more",26718753000,1.59,95,548077005,9.52,5.0,Q3 2025,36.588,Higher Price,stocks_under_$100,2026-07-01,"Q1 2026, Q4 2025, Q3 2025",3
WFC,Wells Fargo,82.64,15,"Bill Nygren, Dodge & Cox Funds, Francis Chou, First Pacific Advisors, Mairs & Power Funds, +5 more",5049653000,1.39,1084,63429868,3.26,2.0,Q4 2025,33.391333333333336,Higher Price,stocks_under_$100,2026-07-01,"Q1 2026, Q4 2025, Q3 2025",3
CMCSA,Comcast Corp.,24.55,14,"Bill Nygren, Glenn Greenberg, Hillman Capital Management, First Eagle Investment Management, Wallace Weitz, +5 more",5511832000,1.19,221,191983018,3.52,17.0,Q4 2025,46.18571428571428,Higher Price,stocks_under_$100,2026-07-01,"Q1 2026, Q4 2025, Q3 2025",3
UBER,Uber Technologies Inc.,72.16,11,"Bill Ackman, David Tepper, Chase Coleman, Pat Dorsey, Polen Capital Management, +5 more",4073814000,3.97,1016,56635826,15.71,16.0,Q4 2025,41.96545454545455,Higher Price,stocks_under_$100,2026-07-01,"Q1 2026, Q4 2025, Q3 2025",3
SCHW,Charles Schwab Corp.,92.27,11,"Viking Global Investors, Bill Nygren, Francois Rochon, Ruane Cunniff LP, John Rogers, +5 more",11652965000,2.72,884,123994094,7.35,13.0,Q4 2025,37.71909090909091,Higher Price,stocks_under_$100,2026-07-01,"Q1 2026, Q4 2025, Q3 2025",3
SUNB,Sunbelt Rentals Holdings Inc,74.81,10,"Abrams Bison Investments, Bill Nygren, Glenn Greenberg, Francois Rochon, Pat Dorsey, +5 more",6217357000,6.56,951,95520083,35.38,11.0,Q1 2026,37.558,Higher Price,stocks_under_$100,2026-07-01,"Q1 2026, Q4 2025, Q3 2025",3
FISV,Fiserv Inc.,49.05,10,"Bill Nygren, Mason Hawkins, Hillman Capital Management, John Rogers, First Eagle Investment Management, +5 more",4621116000,1.21,376,82815682,3.13,28.0,Q4 2025,49.214,Higher Price,stocks_under_$100,2026-07-01,"Q1 2026, Q4 2025, Q3 2025",3
KO,Coca Cola Co.,81.27,9,"Lee Ainslie, Christopher Bloomstran, Warren Buffett, Dodge & Cox Funds, Mairs & Power Funds, +4 more",30692464000,1.69,572,403582686,11.56,5.0,Q4 2025,24.68888888888889,Higher Price,stocks_under_$100,2026-07-01,"Q1 2026, Q4 2025, Q3 2025",3
PFE,Pfizer Inc.,24.08,9,"Prem Watsa, Hillman Capital Management, Sarah Ketterer, Dodge & Cox Funds, Mairs & Power Funds, +4 more",373733000,1.65,787,13309950,3.66,9.0,Q4 2025,28.648888888888887,Higher Price,stocks_under_$100,2026-07-01,"Q1 2026, Q4 2025, Q3 2025",3
MDT,Medtronic plc,78.23,9,"Hillman Capital Management, First Eagle Investment Management, Dodge & Cox Funds, Polen Capital Management, Mairs & Power Funds, +4 more",1961457000,1.13,648,22636550,2.99,7.0,Q4 2025,26.125555555555557,Higher Price,stocks_under_$100,2026-07-01,"Q1 2026, Q4 2025, Q3 2025",3
BN,Brookfield Corp.,42.59,8,"Bill Ackman, Stephen Mandel, Arnold Van Den Berg, Chuck Akre, Dodge & Cox Funds, +3 more",6568469000,7.5,139,162304648,17.62,6.0,Q4 2025,29.49875,Higher Price,stocks_under_$100,2026-07-01,"Q1 2026, Q4 2025, Q3 2025",3
GM,General Motors,77.08,8,"Viking Global Investors, Bill Nygren, Prem Watsa, Francis Chou, Samantha McLemore, +3 more",2787398000,3.41,439,37414744,15.37,4.0,Q4 2025,23.4125,Higher Price,stocks_under_$100,2026-07-01,"Q1 2026, Q4 2025, Q3 2025",3
BABA,Alibaba Group Holdings,95.98,8,"Bill Nygren, David Tepper, Dennis Hong, Sarah Ketterer, Dodge & Cox Funds, +3 more",1860540000,3.23,94,14829757,13.61,7.0,Q4 2025,26.23125,Higher Price,stocks_under_$100,2026-07-01,"Q1 2026, Q4 2025, Q3 2025",3
CPNG,Coupang Inc.,17.37,8,"Bill Nygren, Bill & Melinda Gates Foundation Trust, Henry Ellenbogen, Chase Coleman, Bill Miller, +3 more",2882730000,2.36,249,152687015,6.39,10.0,Q4 2025,28.36375,Higher Price,stocks_under_$100,2026-07-01,"Q1 2026, Q4 2025, Q3 2025",3
KHC,Kraft Heinz Co.,23.62,8,"Bruce Berkowitz, Bill & Melinda Gates Foundation Trust, Mason Hawkins, Warren Buffett, Prem Watsa, +3 more",7601947000,2.19,562,338016834,6.1,9.0,Q4 2025,27.19375,Higher Price,stocks_under_$100,2026-07-01,"Q1 2026, Q4 2025, Q3 2025",3
NFLX,Netflix Inc.,71.4,8,"Bill Nygren, Christopher Bloomstran, Chase Coleman, Ruane Cunniff LP, Polen Capital Management, +3 more",1759515000,2.07,700,18299675,7.8,11.0,Q4 2025,29.07125,Higher Price,stocks_under_$100,2026-07-01,"Q1 2026, Q4 2025, Q3 2025",3
BAX,Baxter International Inc.,21.32,8,"Hillman Capital Management, Dodge & Cox Funds, First Pacific Advisors, Mairs & Power Funds, Tweedy Browne, +3 more",2411440000,1.78,102,143534608,3.96,13.0,Q4 2025,30.77875,Higher Price,stocks_under_$100,2026-07-01,"Q1 2026, Q4 2025, Q3 2025",3
ZBH,Zimmer Biomet Holdings,86.09,8,"Bill Nygren, Hillman Capital Management, John Rogers, Sarah Ketterer, Dodge & Cox Funds, +3 more",3482682000,1.51,1121,38516715,3.5,14.0,Q4 2025,31.50625,Higher Price,stocks_under_$100,2026-07-01,"Q1 2026, Q4 2025, Q3 2025",3
BMY,Bristol-Myers Squibb,57.62,8,"Bill Miller, Hillman Capital Management, John Rogers, Dodge & Cox Funds, Mairs & Power Funds, +3 more",1381827000,1.17,138,22783623,3.37,8.0,Q4 2025,25.16625,Higher Price,stocks_under_$100,2026-07-01,"Q1 2026, Q4 2025, Q3 2025",3
NKE,NIKE Inc.,41.05,8,"Bill Nygren, Hillman Capital Management, Mairs & Power Funds, Jensen Investment Management, Thomas Gayner, +3 more",829433000,0.77,705,15702996,2.86,12.0,Q4 2025,28.76625,Higher Price,stocks_under_$100,2026-07-01,"Q1 2026, Q4 2025, Q3 2025",3
CVNA,Carvana Co.,65.82,7,"Lee Ainslie, Viking Global Investors, Henry Ellenbogen, Stephen Mandel, Clifford Sosin, +2 more",3419618000,17.76,275,54383490,81.67,8.0,Q4 2025,39.76285714285714,Higher Price,stocks_under_$100,2026-07-01,"Q1 2026, Q4 2025, Q3 2025",3
PDD,Pinduoduo Inc.,76.28,7,"Howard Marks, Duan Yongping, Li Lu, Norbert Lou, David Tepper, +2 more",3111456000,6.08,778,30450731,15.67,7.0,Q4 2025,27.084285714285716,Higher Price,stocks_under_$100,2026-07-01,"Q1 2026, Q4 2025, Q3 2025",3
PYPL,PayPal Holdings Inc.,43.18,7,"Norbert Lou, Mason Hawkins, Francis Chou, First Pacific Advisors, Yacktman Asset Management, +2 more",404703000,3.37,829,8947673,10.51,6.0,Q4 2025,23.374285714285715,Higher Price,stocks_under_$100,2026-07-01,"Q1 2026, Q4 2025, Q3 2025",3
SLB,Schlumberger Ltd.,46.49,7,"Arnold Van Den Berg, John Rogers, First Eagle Investment Management, Muhlenkamp, Torray Funds, +2 more",1794223000,2.16,914,34913849,4.36,10.0,Q4 2025,26.15714285714286,Higher Price,stocks_under_$100,2026-07-01,"Q1 2026, Q4 2025, Q3 2025",3
USB,U.S. Bancorp,60.4,7,"Hillman Capital Management, First Eagle Investment Management, Mairs & Power Funds, Christopher Davis, Tweedy Browne, +2 more",1711832000,1.96,1030,32913508,5.31,6.0,Q4 2025,21.96,Higher Price,stocks_under_$100,2026-07-01,"Q1 2026, Q4 2025, Q3 2025",3
AVTR,Avantor Inc.,9.9,7,"Lee Ainslie, Mason Hawkins, Dodge & Cox Funds, First Pacific Advisors, Yacktman Asset Management, +2 more",1253673000,1.18,88,159907216,2.92,13.0,Q4 2025,28.184285714285718,Higher Price,stocks_under_$100,2026-07-01,"Q1 2026, Q4 2025, Q3 2025",3
ABM,ABM Industries,44.24,7,"Lee Ainslie, Bill Nygren, Alex Roepers, First Eagle Investment Management, Vulcan Value Partners, +2 more",222787000,1.1,4,5783710,4.94,11.0,Q4 2025,26.10428571428572,Higher Price,stocks_under_$100,2026-07-01,"Q1 2026, Q4 2025, Q3 2025",3
DEO,Diageo ADR,80.38,7,"Bill Nygren, Hillman Capital Management, First Eagle Investment Management, Sarah Ketterer, Dodge & Cox Funds, +2 more",176134000,0.52,291,2365806,1.42,12.0,Q4 2025,26.52285714285714,Higher Price,stocks_under_$100,2026-07-01,"Q1 2026, Q4 2025, Q3 2025",3
HDB,HDFC Bank Ltd.,25.83,7,"Howard Marks, Mason Hawkins, John Rogers, Sarah Ketterer, Dodge & Cox Funds, +2 more",193309000,0.06,466,7769693,0.12,9.0,Q4 2025,23.057142857142857,Higher Price,stocks_under_$100,2026-07-01,"Q1 2026, Q4 2025, Q3 2025",3
CP,Canadian Pacific Kansas City,86.65,6,"Chris Hohn, AKO Capital, Sarah Ketterer, William Von Mueffling, Thomas Gayner, +1 more",4914413000,3.87,246,62496034,8.49,12.0,Q4 2025,27.86833333333333,Higher Price,stocks_under_$100,2026-07-01,"Q1 2026, Q4 2025, Q3 2025",3
CSGP,CoStar Group Inc.,28.32,6,"Chase Coleman, Hillman Capital Management, Chuck Akre, Dennis Hong, Wallace Weitz, +1 more",1019929000,2.9,262,25283304,6.83,8.0,Q4 2025,22.901666666666667,Higher Price,stocks_under_$100,2026-07-01,"Q1 2026, Q4 2025, Q3 2025",3
IFF,International Flavors & Fragrances Inc.,79.22,6,"Carl Icahn, Hillman Capital Management, First Eagle Investment Management, Dodge & Cox Funds, First Pacific Advisors, +1 more",4038445000,2.9,513,55664310,5.61,12.0,Q4 2025,26.9,Higher Price,stocks_under_$100,2026-07-01,"Q1 2026, Q4 2025, Q3 2025",3
KKR,KKR & Co. L.P.,91.78,6,"ValueAct Capital, Bill Nygren, Stephen Mandel, John Rogers, Chuck Akre, +1 more",1150525000,2.87,563,12438106,10.16,5.0,Q4 2025,19.87,Higher Price,stocks_under_$100,2026-07-01,"Q1 2026, Q4 2025, Q3 2025",3
EPD,Enterprise Products Partners LP,36.76,6,"Bruce Berkowitz, Leon Cooperman, First Eagle Investment Management, Tweedy Browne, Muhlenkamp, +1 more",342432000,2.65,335,9049440,13.63,6.0,Q4 2025,20.65333333333333,Higher Price,stocks_under_$100,2026-07-01,"Q1 2026, Q4 2025, Q3 2025",3
TSN,Tyson Foods,57.25,6,"Christopher Davis, Tweedy Browne, Thomas Gayner, Yacktman Asset Management, Richard Pzena, +1 more",2181718000,2.06,1008,34052063,3.85,17.0,Q4 2025,31.063333333333333,Higher Price,stocks_under_$100,2026-07-01,"Q1 2026, Q4 2025, Q3 2025",3
NOW,ServiceNow Inc.,99.28,6,"Chase Coleman, Hillman Capital Management, Chuck Akre, Polen Capital Management, Vulcan Value Partners, +1 more",1093342000,1.74,712,10457600,5.26,8.0,Q4 2025,21.741666666666667,Higher Price,stocks_under_$100,2026-07-01,"Q1 2026, Q4 2025, Q3 2025",3
CPRT,Copart Inc.,28.19,6,"David Rolfe, Francois Rochon, AKO Capital, Chuck Akre, Jensen Investment Management, +1 more",347833000,1.47,251,10476897,4.34,10.0,Q4 2025,23.47,Higher Price,stocks_under_$100,2026-07-01,"Q1 2026, Q4 2025, Q3 2025",3
GSK,GSK plc,52.42,6,"Hillman Capital Management, Sarah Ketterer, Dodge & Cox Funds, Kahn Brothers Group, Tweedy Browne, +1 more",3258038000,1.24,452,59033106,3.73,4.0,Q4 2025,17.243333333333332,Higher Price,stocks_under_$100,2026-07-01,"Q1 2026, Q4 2025, Q3 2025",3
GEHC,GE HealthCare Technologies Inc.,64.01,6,"Nelson Peltz, Bill Nygren, Christopher Bloomstran, Leon Cooperman, Dodge & Cox Funds, +1 more",3472048000,1.2,425,48778418,2.85,13.0,Q4 2025,26.195,Higher Price,stocks_under_$100,2026-07-01,"Q1 2026, Q4 2025, Q3 2025",3
VZ,Verizon Communications,42.34,6,"Bill Miller, Hillman Capital Management, Mairs & Power Funds, Kahn Brothers Group, Tweedy Browne, +1 more",180624000,1.06,1077,3598088,2.27,2.0,Q4 2025,15.055,Higher Price,stocks_under_$100,2026-07-01,"Q1 2026, Q4 2025, Q3 2025",3
ABT,Abbott Labs,90.74,6,"Lee Ainslie, Dodge & Cox Funds, Polen Capital Management, Mairs & Power Funds, Thomas Russo, +1 more",411695000,0.98,6,4009889,3.01,3.0,Q3 2025,15.981666666666667,Higher Price,stocks_under_$100,2026-07-01,"Q1 2026, Q4 2025, Q3 2025",3
MICC,Magnum Ice Cream Co NV,17.41,6,"Nelson Peltz, Mason Hawkins, First Eagle Investment Management, First Pacific Advisors, Tweedy Browne, +1 more",484867000,0.44,656,33873350,1.19,9.0,Q4 2025,21.438333333333333,Higher Price,stocks_under_$100,2026-07-01,"Q1 2026, Q4 2025, Q3 2025",3
CL,Colgate-Palmolive,91.68,6,"First Eagle Investment Management, Dodge & Cox Funds, Jensen Investment Management, Yacktman Asset Management, Lindsell Train, +1 more",771434000,0.39,212,9051205,1.17,6.0,Q4 2025,18.386666666666667,Higher Price,stocks_under_$100,2026-07-01,"Q1 2026, Q4 2025, Q3 2025",3
IBKR,Interactive Brokers Group Inc.,87.04,5,"Viking Global Investors, Bryan Lawrence, John Armitage, Robert Vinall, William Von Mueffling",1388898000,10.76,505,20704048,30.5,4.0,Q4 2025,24.76,Higher Price,stocks_under_$100,2026-07-01,"Q1 2026, Q4 2025, Q3 2025",3
OXY,Occidental Petroleum,48.57,5,"Duan Yongping, Li Lu, Warren Buffett, Dodge & Cox Funds, Francis Chou",22819421000,5.06,760,351068003,9.79,2.0,Q4 2025,17.06,Higher Price,stocks_under_$100,2026-07-01,"Q1 2026, Q4 2025, Q3 2025",3
CNH,CNH Industrial NV,11.23,5,"David Einhorn, Bill Nygren, Mason Hawkins, First Pacific Advisors, Tweedy Browne",1000919000,4.53,225,90992480,17.61,3.0,Q4 2025,17.534,Higher Price,stocks_under_$100,2026-07-01,"Q1 2026, Q4 2025, Q3 2025",3
ZTS,Zoetis Inc.,71.86,5,"David Rolfe, Terry Smith, Ruane Cunniff LP, Polen Capital Management, Mairs & Power Funds",1293489000,2.98,1130,10942302,4.76,7.0,Q4 2025,19.984,Higher Price,stocks_under_$100,2026-07-01,"Q1 2026, Q4 2025, Q3 2025",3
TECH,Bio-Techne Corp.,70.65,5,"Lee Ainslie, Henry Ellenbogen, Ruane Cunniff LP, Wallace Weitz, Mairs & Power Funds",835701000,2.41,973,15991221,2.94,10.0,Q4 2025,22.414,Higher Price,stocks_under_$100,2026-07-01,"Q1 2026, Q4 2025, Q3 2025",3
MDLN,Medline Inc Cl A,39.44,5,"Lee Ainslie, Viking Global Investors, Henry Ellenbogen, Stephen Mandel, John Armitage",1586463000,2.3,646,35650880,4.18,8.0,Q4 2025,20.3,Higher Price,stocks_under_$100,2026-07-01,"Q1 2026, Q4 2025, Q3 2025",3
