ticker,company_name,manager_count,managers,total_value,avg_portfolio_pct,max_portfolio_pct,total_shares,manager_quality,under_radar_score,first_established,recent_additions,pick_type,_analysis_type,_generated,_periods,_window_quarters
AMR,Alpha Metallurgical Resources Inc.,1,Mohnish Pabrai,119003000,28.14,28.14,579738,1.3,73.164,Q2 2024,2.0,Growing Interest,under_radar_picks,2026-07-20,"Q2 2026, Q1 2026, Q4 2025",3
HCC,Warrior Met Coal Inc.,2,"Mohnish Pabrai, Third Avenue Management",202586000,22.7,39.89,2174833,1.3,51.857,Q4 2023,1.0,Growing Interest,under_radar_picks,2026-07-20,"Q2 2026, Q1 2026, Q4 2025",3
RIG,Transocean Ltd.,2,"Arnold Van Den Berg, Mohnish Pabrai",135387000,16.0,31.97,20420415,1.3,41.561,Q1 2022,1.0,Growing Interest,under_radar_picks,2026-07-20,"Q2 2026, Q1 2026, Q4 2025",3
EWBC,East West Bancorp,2,"Lee Ainslie, Li Lu",297919000,4.64,9.26,2790554,1.5,13.89,Q1 2026,1.0,Growing Interest,under_radar_picks,2026-07-20,"Q2 2026, Q1 2026, Q4 2025",3
LLYVK,Liberty Media Corp. Series C Live,2,"ValueAct Capital, Warren Buffett",1331501000,3.12,5.87,14148351,2.0,11.74,Q3 2024,1.0,Premium Pick,under_radar_picks,2026-07-20,"Q2 2026, Q1 2026, Q4 2025",3
CCC,CCC Intelligent Solutions Hldgs Inc.,2,"Triple Frond Partners, Chuck Akre",221556000,3.23,3.37,36926106,1.6,5.392,Q2 2025,5.0,Growing Interest,under_radar_picks,2026-07-20,"Q2 2026, Q1 2026, Q4 2025",3
SEG,Seaport Entertainment Group,2,"Bill Ackman, Kahn Brothers Group",127098000,2.09,3.4,5917007,1.4,4.76,Q3 2024,2.0,Growing Interest,under_radar_picks,2026-07-20,"Q2 2026, Q1 2026, Q4 2025",3
