ticker,company_name,current_price,top_managers,managers_shown,manager_count,total_value,avg_portfolio_pct,total_shares,max_portfolio_pct,first_reported_date,latest_period,buy_count,last_buy_period,historical_buyers,active_managers,appeal_score,investment_timing,reported_price,_analysis_type,_generated,_periods,_window_quarters
IFF,International Flavors & Fragrances Inc.,79.22,"Carl Icahn, Hillman Capital Management, First Eagle Investment Management, Dodge & Cox Funds, First Pacific Advisors, +1 more",5,6,4038445000,2.9,55664310,5.61,"Dec 31, 2014",Q4 2025,34.0,Q4 2025,12.0,6,5.96,Strong,72.55,interesting_stocks_overview,2026-07-01,"Q1 2026, Q4 2025",1
KKR,KKR & Co. L.P.,91.78,"ValueAct Capital, Bill Nygren, Stephen Mandel, John Rogers, Chuck Akre, +1 more",5,6,1150525000,2.87,12438106,10.16,"July 19, 2011",Q4 2025,55.0,Q4 2025,12.0,6,5.95,Strong,92.5,interesting_stocks_overview,2026-07-01,"Q1 2026, Q4 2025",1
HD,Home Depot,352.68,"Viking Global Investors, Terry Smith, First Eagle Investment Management, Dodge & Cox Funds, Mairs & Power Funds, +1 more",5,9,570899000,0.59,1735834,2.53,,Q4 2025,40.0,Q4 2025,11.0,9,5.94,Strong,328.89,interesting_stocks_overview,2026-07-01,"Q1 2026, Q4 2025",1
PGR,Progressive Corp.,218.45,"Viking Global Investors, Bruce Berkowitz, Glenn Greenberg, David Rolfe, Francois Rochon, +1 more",5,8,607593000,1.31,3064935,3.83,"Jun 29, 2017",Q4 2025,54.0,Q4 2025,12.0,8,5.92,Strong,198.24,interesting_stocks_overview,2026-07-01,"Q1 2026, Q4 2025",1
MELI,Mercadolibre Inc.,1697.39,"Lee Ainslie, Henry Ellenbogen, Chase Coleman, Bill Miller, Wallace Weitz, +1 more",5,8,976635000,1.28,564849,6.24,,Q4 2025,26.0,Q4 2025,12.0,8,5.91,Strong,1729.01,interesting_stocks_overview,2026-07-01,"Q1 2026, Q4 2025",1
CBRE,CBRE Group,134.69,"ValueAct Capital, Bill Nygren, John Rogers, Third Avenue Management, William Von Mueffling, +1 more",5,8,1539194000,1.27,11362717,3.54,"Dec 31, 2014",Q4 2025,48.0,Q4 2025,10.0,8,5.91,Strong,135.46,interesting_stocks_overview,2026-07-01,"Q1 2026, Q4 2025",1
RPRX,Royalty Pharma plc,56.07,"Pat Dorsey, Samantha McLemore, Torray Funds",3,3,314957000,6.69,6565711,8.7,,Q4 2025,26.0,Q4 2025,5.0,3,5.9,Strong,47.97,interesting_stocks_overview,2026-07-01,"Q1 2026, Q4 2025",1
DCH,Dauch Corp.,5.42,"David Einhorn, Alex Roepers, Bill Miller",3,3,68475000,5.53,11547255,13.27,,Q4 2025,23.0,Q4 2025,3.0,3,5.9,Strong,5.93,interesting_stocks_overview,2026-07-01,"Q1 2026, Q4 2025",1
