ticker,company_name,total_recent_managers,new_managers_count,recent_buy_activities,emergence_score,new_managers,total_managers,new_manager_names,_analysis_type,_generated,_periods,_window_quarters
AMZN,Amazon.com Inc.,31,8,40,320,"VA, OFALX, psc, mc, SP, GR, JIM, pcm",43,"ValueAct Capital, Robert Olstein, Bill Ackman, Lee Ainslie, Dennis Hong, Thomas Russo, Jensen Inv...",theme_emergence_detection,2026-04-01,"Q4 2025, Q3 2025, Q2 2025, Q1 2025, Q4 2024",5
TSM,Taiwan Semiconductor S.A.,21,9,35,315,"DAV, T, HH, MPGFX, vg, FE, mc, DODGX, pcm",24,"Christopher Davis, Torray Funds, Duan Yongping, Mairs & Power Growth Fund, Viking Global Investor...",theme_emergence_detection,2026-04-01,"Q4 2025, Q3 2025, Q2 2025, Q1 2025, Q4 2024",5
MSFT,Microsoft Corp.,37,5,56,280,"HH, FE, mc, RVC, pcm",43,"Duan Yongping, First Eagle Investment Management, Lee Ainslie, Robert Vinall, Polen Capital Manag...",theme_emergence_detection,2026-04-01,"Q4 2025, Q3 2025, Q2 2025, Q1 2025, Q4 2024",5
UNH,United Health Group Inc.,25,8,35,280,"YAM, SAM, CAU, mc, FE, PTNT, pcm, hcmax",31,"Yacktman Asset Management, Michael Burry, Sarah Ketterer, Lee Ainslie, First Eagle Investment Man...",theme_emergence_detection,2026-04-01,"Q4 2025, Q3 2025, Q2 2025, Q1 2025, Q4 2024",5
META,Meta Platforms Inc.,31,6,41,246,"psc, MPGFX, FE, mc, JIM, pcm",44,"Bill Ackman, Mairs & Power Growth Fund, First Eagle Investment Management, Lee Ainslie, Jensen In...",theme_emergence_detection,2026-04-01,"Q4 2025, Q3 2025, Q2 2025, Q1 2025, Q4 2024",5
NVDA,NVIDIA Corp.,15,6,33,198,"DAV, HH, KB, mc, JIM, pcm",19,"Christopher Davis, Duan Yongping, Kahn Brothers Group, Lee Ainslie, Jensen Investment Management,...",theme_emergence_detection,2026-04-01,"Q4 2025, Q3 2025, Q2 2025, Q1 2025, Q4 2024",5
GOOGL,Alphabet Inc.,36,4,38,152,"pcm, BRK, FE, mc",43,"Polen Capital Management, Warren Buffett, First Eagle Investment Management, Lee Ainslie",theme_emergence_detection,2026-04-01,"Q4 2025, Q3 2025, Q2 2025, Q1 2025, Q4 2024",5
FISV,Fiserv Inc.,18,6,25,150,"DAV, AM, ARFFX, PC, CAAPX, hcmax",24,"Christopher Davis, David Tepper, Charles Bobrinskoy, Norbert Lou, John Rogers, Hillman Value Fund",theme_emergence_detection,2026-04-01,"Q4 2025, Q3 2025, Q2 2025, Q1 2025, Q4 2024",5
FERG,Ferguson Enterprises Inc.,12,6,24,144,"BAUPOST, EC, DCP, FE, mc, pcm",15,"Seth Klarman, John Armitage, Henry Ellenbogen, First Eagle Investment Management, Lee Ainslie, Po...",theme_emergence_detection,2026-04-01,"Q4 2025, Q3 2025, Q2 2025, Q1 2025, Q4 2024",5
ICLR,ICON plc,10,8,16,128,"BAUPOST, cc, GA, CAU, mc, pcm, oaklx, SEQUX",10,"Seth Klarman, William Von Mueffling, Greenhaven Associates, Sarah Ketterer, Lee Ainslie, Polen Ca...",theme_emergence_detection,2026-04-01,"Q4 2025, Q3 2025, Q2 2025, Q1 2025, Q4 2024",5
COF,Capital One Financial,17,6,19,114,"CCM, EC, tp, vg, KB, mc",22,"Glenn Greenberg, John Armitage, Daniel Loeb, Viking Global Investors, Kahn Brothers Group, Lee Ai...",theme_emergence_detection,2026-04-01,"Q4 2025, Q3 2025, Q2 2025, Q1 2025, Q4 2024",5
GOOG,Alphabet Inc. CL C,28,4,26,104,"KB, pcm, FE, mc",40,"Kahn Brothers Group, Polen Capital Management, First Eagle Investment Management, Lee Ainslie",theme_emergence_detection,2026-04-01,"Q4 2025, Q3 2025, Q2 2025, Q1 2025, Q4 2024",5
CP,Canadian Pacific Kansas City,11,5,18,90,"MKL, LT, FE, mc, AKO",14,"Thomas Gayner, Lindsell Train, First Eagle Investment Management, Lee Ainslie, AKO Capital",theme_emergence_detection,2026-04-01,"Q4 2025, Q3 2025, Q2 2025, Q1 2025, Q4 2024",5
ADBE,Adobe Inc.,13,5,18,90,"MKL, OFALX, mc, DODGX, pcm",25,"Thomas Gayner, Robert Olstein, Lee Ainslie, Dodge & Cox, Polen Capital Management",theme_emergence_detection,2026-04-01,"Q4 2025, Q3 2025, Q2 2025, Q1 2025, Q4 2024",5
FLUT,Flutter Entertainment Plc,10,4,22,88,"mc, DCP, LPC, AKO",11,"Lee Ainslie, Henry Ellenbogen, Stephen Mandel, AKO Capital",theme_emergence_detection,2026-04-01,"Q4 2025, Q3 2025, Q2 2025, Q1 2025, Q4 2024",5
TMO,Thermo Fisher Scientific,12,4,20,80,"LT, tp, pcm, OFALX",20,"Lindsell Train, Daniel Loeb, Polen Capital Management, Robert Olstein",theme_emergence_detection,2026-04-01,"Q4 2025, Q3 2025, Q2 2025, Q1 2025, Q4 2024",5
UBER,Uber Technologies Inc.,11,4,20,80,"OFALX, psc, pcm, mc",17,"Robert Olstein, Bill Ackman, Polen Capital Management, Lee Ainslie",theme_emergence_detection,2026-04-01,"Q4 2025, Q3 2025, Q2 2025, Q1 2025, Q4 2024",5
LLY,Eli Lilly & Co.,9,5,15,75,"EC, LPC, mc, JIM, pcm",13,"John Armitage, Stephen Mandel, Lee Ainslie, Jensen Investment Management, Polen Capital Management",theme_emergence_detection,2026-04-01,"Q4 2025, Q3 2025, Q2 2025, Q1 2025, Q4 2024",5
INTU,Intuit Inc.,14,4,18,72,"T, pcm, mc, MAVFX",16,"Torray Funds, Polen Capital Management, Lee Ainslie, David Katz",theme_emergence_detection,2026-04-01,"Q4 2025, Q3 2025, Q2 2025, Q1 2025, Q4 2024",5
AVGO,Broadcom Inc.,10,5,14,70,"LPC, CAU, JIM, pcm, MAVFX",12,"Stephen Mandel, Sarah Ketterer, Jensen Investment Management, Polen Capital Management, David Katz",theme_emergence_detection,2026-04-01,"Q4 2025, Q3 2025, Q2 2025, Q1 2025, Q4 2024",5
ASML,ASML Holding NV,9,5,14,70,"TFP, HH, mc, DA, pcm",10,"Triple Frond Partners, Duan Yongping, Lee Ainslie, Pat Dorsey, Polen Capital Management",theme_emergence_detection,2026-04-01,"Q4 2025, Q3 2025, Q2 2025, Q1 2025, Q4 2024",5
LPLA,LPL Financial Holdings Inc.,10,4,17,68,"DODGX, FE, mc, cc",12,"Dodge & Cox, First Eagle Investment Management, Lee Ainslie, William Von Mueffling",theme_emergence_detection,2026-04-01,"Q4 2025, Q3 2025, Q2 2025, Q1 2025, Q4 2024",5
SE,Sea Ltd,10,6,11,66,"tp, oc, vg, FE, CAU, pcm",12,"Daniel Loeb, Howard Marks, Viking Global Investors, First Eagle Investment Management, Sarah Kett...",theme_emergence_detection,2026-04-01,"Q4 2025, Q3 2025, Q2 2025, Q1 2025, Q4 2024",5
EFX,Equifax Inc.,10,3,22,66,"VFC, mc, oaklx",15,"Valley Forge Capital Management, Lee Ainslie, Bill Nygren",theme_emergence_detection,2026-04-01,"Q4 2025, Q3 2025, Q2 2025, Q1 2025, Q4 2024",5
DIS,Walt Disney Co.,17,3,22,66,"FE, mc, vg",32,"First Eagle Investment Management, Lee Ainslie, Viking Global Investors",theme_emergence_detection,2026-04-01,"Q4 2025, Q3 2025, Q2 2025, Q1 2025, Q4 2024",5
